{
  "schema_version": "1.0.0",
  "family": "windows-security",
  "captured_at_utc": "2026-09-04T18:22:47Z",
  "advisory_only": true,
  "techniques": [
    {"id": "T1484", "name": "Domain or Tenant Policy Modification", "platforms": ["Windows", "Identity Provider"], "tactics": ["Defense Impairment", "Privilege Escalation"], "url": "https://attack.mitre.org/techniques/T1484/"},
    {"id": "T1484.001", "name": "Group Policy Modification", "platforms": ["Windows"], "tactics": ["Defense Impairment", "Privilege Escalation"], "url": "https://attack.mitre.org/techniques/T1484/001/"},
    {"id": "T1003", "name": "OS Credential Dumping", "platforms": ["Windows", "Linux", "macOS"], "tactics": ["Credential Access"], "url": "https://attack.mitre.org/techniques/T1003/"},
    {"id": "T1003.003", "name": "NTDS", "parent": "T1003", "platforms": ["Windows"], "tactics": ["Credential Access"], "url": "https://attack.mitre.org/techniques/T1003/003/"},
    {"id": "T1003.006", "name": "DCSync", "parent": "T1003", "platforms": ["Windows"], "tactics": ["Credential Access"], "url": "https://attack.mitre.org/techniques/T1003/006/"},
    {"id": "T1558", "name": "Steal or Forge Kerberos Tickets", "platforms": ["Windows", "Linux", "macOS"], "tactics": ["Credential Access"], "url": "https://attack.mitre.org/techniques/T1558/"},
    {"id": "T1558.001", "name": "Golden Ticket", "parent": "T1558", "platforms": ["Windows"], "tactics": ["Credential Access"], "url": "https://attack.mitre.org/techniques/T1558/001/"},
    {"id": "T1558.002", "name": "Silver Ticket", "parent": "T1558", "platforms": ["Windows"], "tactics": ["Credential Access"], "url": "https://attack.mitre.org/techniques/T1558/002/"},
    {"id": "T1558.003", "name": "Kerberoasting", "parent": "T1558", "platforms": ["Windows"], "tactics": ["Credential Access"], "url": "https://attack.mitre.org/techniques/T1558/003/"},
    {"id": "T1558.004", "name": "AS-REP Roasting", "parent": "T1558", "platforms": ["Windows"], "tactics": ["Credential Access"], "url": "https://attack.mitre.org/techniques/T1558/004/"}
  ]
}
